{
  "schema_version": "1.0.0",
  "contract_type": "RiskAssessmentRequest",
  "workflow_id": "wf_01",
  "correlation_id": "corr_01",
  "causation_id": "evt_03",
  "timestamp_utc": "2026-04-08T10:19:00Z",
  "originator": {
    "type": "service",
    "id": "workflow_orchestrator"
  },
  "environment": "paper",
  "operating_mode": "MODE-001",
  "payload": {
    "risk_request_id": "riskreq_01",
    "proposal_id": "prop_01",
    "action_type": "new_entry",
    "account_snapshot_ref": "acctsnap_01",
    "portfolio_snapshot_ref": "portsnap_01",
    "market_snapshot_ref": "mktsnap_01",
    "requested_freshness_classes": {
      "account_snapshot": "HOT",
      "portfolio_snapshot": "WARM",
      "market_snapshot": "HOT"
    },
    "strategy_lifecycle_state": "paper",
    "active_policy_bundle": {
      "policy_version": "risk_policy_3.2.1",
      "formula_version": "risk_formula_1.4.0"
    },
    "compliance_profile_id": "comp_default",
    "current_kill_switch_state": "inactive"
  }
}
